"URL","Puesto","Empresa","Lugar","Direccion","Distancia","Duracion","ZBE","Publicacion","Modalidad","Tipo","Solicitud","Experiencia","Resumen","Tipo_clasificacion","Clasificacion"
"https://www.linkedin.com/comm/jobs/view/4374170854/","Experto en Agentes Conversacionales IA - Data & IA","Santander","Madrid, Comunidad de Madrid, España","Madrid, Spain","64.9","53.0","True","","Madrid y alrededores (Híbrido)","Jornada completa","Se aceptan solicitudes","2","Aquí tienes un resumen claro y conciso de la oferta: ### **Puesto: Experto de Agentes Conversacionales IA (Data & AI)** **Ubicación:** Madrid, España. **Empresa:** Banco Santander. --- ### **Funciones principales** * **Desarrollo y evolución:** Implementar y optimizar agentes conversacionales (chat/voz) en producción, gestionando flujos, contextos y transiciones a agentes humanos. * **IA y NLP:** Construir componentes basados en NLP y LLMs (RAG, prompt engineering, guardrails, clasificación de intents). * **Análisis y Calidad:** Ejecutar evaluaciones técnicas (precisión, latencia), analizar logs para detectar fallos y mantener datasets conversacionales. * **Integración y Seguridad:** Conectar agentes con sistemas internos (APIs, CRM) y asegurar el cumplimiento de normativas de seguridad (PII, GDPR). ### **Requisitos esenciales** * **Experiencia:** +2 años en IA aplicada, NLP o automatización con chatbots/voicebots en entornos productivos. * **Habilidades técnicas:** * Manejo de plataformas conversacionales (ej. Dialogflow, Azure, Lex, Watson, etc.). * Dominio de Python (o JavaScript), Git, SQL y APIs REST. * Conocimientos sólidos en LLMs (RAG, prompting, evaluación de calidad). * Prácticas de MLOps/LLMOps. * **Formación:** Grado en Ingeniería, Matemáticas, Física, Ciencia de Datos o similar. * **Idiomas:** Inglés nivel C1 (imprescindible). ### **Beneficios principales** * **Salario:** Paquete retributivo competitivo. * **Bienestar:** Acceso al programa global *BeHealthy* y apoyo a la conciliación familiar. * **Crecimiento:** Oportunidades de movilidad internacional, formación continua y planes de carrera. * **Impacto social:** Posibilidad de participar en programas de voluntariado corporativo dentro del horario laboral.","Empresa final","**Clasificación:** Empresa final **Justificación:** La oferta es publicada directamente por Banco Santander (mencionado explícitamente como el empleador y responsable de la marca). El candidato se incorporará a sus equipos internos para trabajar en el desarrollo de su propia plataforma de servicios financieros, utilizando tecnología propia y siguiendo sus políticas internas de cultura, bienestar y beneficios corporativos (""En Santander trabajamos para crear una plataforma líder"", ""En Santander puedes esperar un paquete retributivo"")."
"https://www.linkedin.com/comm/jobs/view/4410592042/","Beca Proeduca - Data Analytics","Qualentum","Pozuelo de Alarcón, Comunidad de Madrid, España","Municipality of Pozuelo de Alarcón, Madrid, Spain","73.7","51.6","False","","Híbrido","Jornada completa","Se aceptan solicitudes","N/A","Aquí tienes un resumen claro y conciso de la oferta de becas de **Proeduca**: ### **Programa de Becas en Data Analytics** Proeduca ofrece una oportunidad de formación práctica de alto nivel en su grupo educativo, orientada a jóvenes profesionales que buscan especializarse en el ámbito de los datos. #### **Requisitos** * **Formación:** Titulados o estudiantes finalizando carreras STEM (Ingeniería, Matemáticas, Estadística, Física). * **Perfil:** Analítico, con curiosidad técnica, capacidad de aprendizaje rápido, atención al detalle y orientación al trabajo en equipo. #### **Funciones principales** * Análisis de grandes volúmenes de datos y generación de *insights*. * Diseño y desarrollo de dashboards (Tableau, PowerBI). * Automatización de procesos y análisis avanzado (Python). * Extracción, limpieza y carga de datos (SQL/Python). * Colaboración interdepartamental para proponer soluciones basadas en datos. #### **Beneficios** * **Duración y horario:** 11 meses de prácticas con jornada de 30 horas semanales. * **Ayuda económica:** 600 € mensuales. * **Formación:** Título propio en Data Analytics por la UNIR. * **Desarrollo:** Mentorización por perfiles senior y trabajo en proyectos reales. * **Proyección:** Posibilidad de incorporación a la empresa tras finalizar la beca. * **Fecha de inicio:** 1 de septiembre.","Empresa final","**Clasificación:** Empresa final **Justificación:** La oferta corresponde a **Proeduca** (grupo educativo líder en educación online), quien busca incorporar becarios directamente en su propia estructura. Frases como ""incorporarte al grupo educativo"", ""integración en equipos de proyecto"" de la empresa y las ""posibilidades de incorporación en Proeduca tras la finalización"" confirman que se trata de una empresa final que gestiona su propio programa de talento para sus proyectos internos y no para terceros."
"https://www.linkedin.com/comm/jobs/view/4397932518/","Data Engineer (Google Cloud Platform)","SDG Group España","España","N/A","N/A","N/A","N/A","","En remoto","Jornada completa","Se aceptan solicitudes","3","Aquí tienes el resumen de la oferta para **Data Engineer** en **SDG Group**: ### **Resumen del puesto** SDG Group, consultora global especializada en Data, Analytics e IA, busca un profesional para diseñar y desarrollar arquitecturas de datos en la nube (GCP) para clientes de alto nivel (IBEX-35/Fortune 500). ### **Funciones principales** * **Desarrollo de pipelines:** Creación y optimización de flujos de datos (ingesta y transformación) mediante herramientas como GCP (Dataflow, BigQuery, Airflow). * **Modelado de datos:** Diseño y optimización de modelos en entornos Data Warehouse enfocados en el negocio. * **Arquitectura:** Colaboración en la definición de arquitecturas Cloud (Cloud Storage, Cloud Functions). * **Gestión de proyectos:** Toma de requisitos con clientes y participación activa en el ciclo de vida del dato. * **Formación continua:** Actualización constante en nuevas tecnologías y mentoría interna. ### **Requisitos clave** * **Formación:** Ingeniería (Informática, Telecomunicaciones, Data Science, etc.) o Ciclo Superior equivalente. * **Experiencia:** Mínimo 3 años en proyectos end-to-end de Data & Analytics. * **Habilidades técnicas:** Dominio de SQL, procesos ETL y modelado de datos en entornos Cloud, específicamente en **GCP**. * **Perfil:** Actitud proactiva, habilidades comunicativas orientadas a negocio y capacidad de trabajo en equipo. * **Idioma:** Nivel de inglés valorable (entorno global). ### **Beneficios principales** * **Crecimiento:** Plan de carrera basado en meritocracia con revisiones salariales periódicas y camino técnico o de gestión. * **Flexibilidad:** Modelo híbrido o 100% remoto, jornada intensiva los viernes y durante verano. * **Formación:** Plan de aprendizaje continuo (certificaciones, workshops y acceso a I+D). * **Compensación:** Salario competitivo, retribución flexible (seguro médico, ticket restaurante, etc.) y ayuda para teletrabajo. * **Cultura:** Entorno colaborativo, diverso, inclusivo y con proyectos de alto impacto tecnológico.","Outsourcing","**Clasificación:** Outsourcing **Justificación:** Se define explícitamente como una ""consultora global"" que desarrolla ""más de 1.000 proyectos desarrollados anualmente"" para terceros (clientes del ""IBEX-35 y Fortune 500""). La oferta menciona que el candidato deberá ""asistir a reuniones con el cliente para la toma de requisitos"" y ""ayudar a la toma de decisiones de nuestros clientes"", lo que confirma que el trabajo se realiza para proyectos de clientes externos y no para un producto propio de la empresa."
"https://www.linkedin.com/comm/jobs/view/4307215858/","Consultor/a Financial Analytics","KPMG España","Madrid, Comunidad de Madrid, España","P.º de la Castellana, 259C, Torre de cristal, Planta 48, Fuencarral-El Pardo, 28046 Madrid, Spain","56.6","40.6","True","","Híbrido","Jornada completa","Se aceptan solicitudes","N/A","Aquí tienes un resumen claro y conciso de la oferta de empleo para **Consultor/a de Financial Analytics en KPMG (Madrid)**: ### **Perfil del puesto** KPMG busca profesionales para su área de *Financial Services Consulting* que trabajen con clientes del sector financiero (banca y seguros) en proyectos de gestión de riesgos, regulación y analítica de datos. ### **Requisitos** * **Experiencia:** Mínimo 2 años en funciones similares. * **Formación:** Grado en carreras STEM (Informática, Matemáticas, Estadística, Física o Telecomunicaciones). Se valorará máster en *Data Science/Big Data*. * **Competencias técnicas:** Conocimientos avanzados de programación (SAS, SQL, VBA, R o Python). * **Idiomas:** Nivel avanzado de inglés. * **Soft skills:** Capacidad analítica, resolución de problemas, orientación a objetivos y habilidades comunicativas. ### **Funciones principales** * Elaboración de modelos de medición y calificación (cuantitativos/cualitativos). * Diseño de estrategias de transformación tecnológica (RPA, IA, NLP, etc.). * Desarrollo de modelos de gestión de riesgos, procesos y políticas financieras. * Implementación de entornos de analítica avanzada y cuadros de mando interactivos. ### **Beneficios** * **Conciliación y flexibilidad:** Posibilidad de teletrabajo, 31 días de vacaciones y tarde del cumpleaños libre. * **Desarrollo:** Plan de carrera personalizado, formación continua y oportunidades internacionales. * **Compensación:** Salario competitivo y plan de remuneración flexible. * **Bienestar:** Acceso a la plataforma *Kteam* (servicios, promociones y bienestar). * **Entorno:** Ambiente de trabajo dinámico, colaborativo y con enfoque en la diversidad e igualdad de oportunidades.","Outsourcing (Consultora)","**Clasificación:** Outsourcing (Consultora) **Justificación:** Se trata de una empresa de consultoría profesional (KPMG). La oferta especifica que el trabajo se realiza ""principalmente con empresas del sector financiero: bancos y aseguradoras"" y menciona explícitamente que los proyectos se ejecutan ""in situ, mano a mano con el cliente"". El modelo de negocio se basa en prestar servicios especializados a terceros mediante proyectos de duración determinada, lo cual es la definición clásica de una empresa de servicios de consultoría/outsourcing."
"https://www.linkedin.com/comm/jobs/view/4416801597/","Especialista en Power BI y Analítica de Datos (MS Fabric – Reporting & BI)","Indra Group","Torrejón de Ardoz, Comunidad de Madrid, España","Carr. de Loeches, 9, 28850 Torrejón de Ardoz, Madrid, Spain","39.4","32.0","False","","Híbrido","Jornada completa","Se aceptan solicitudes","3","Aquí tienes el resumen de la oferta para **Especialista en Power BI y Analítica de Datos** en **Indra Group**: ### **Perfil del puesto** * **Ubicación:** Torrejón de Ardoz (Madrid). * **Modalidad:** Híbrida (hasta 40% teletrabajo). * **Área:** Data & Analytics. ### **Funciones principales** * **Desarrollo BI:** Diseño y optimización de soluciones de Business Intelligence y cuadros de mando en **Power BI** (entorno MS Fabric). * **Gestión de Datos:** Modelado de datos, gestión de BBDD (SQL Server, PostgreSQL) y desarrollo de procesos **ETL**. * **Reporte Estratégico:** Elaboración de informes para dirección y traducción de necesidades de negocio en soluciones analíticas. * **Gestión:** Participación en la planificación, seguimiento de proyectos y gestión de *stakeholders*. ### **Requisitos** * **Formación:** Ingeniería (Informática, Telecomunicaciones, Industrial), Matemáticas, Estadística o equivalente. * **Experiencia:** Mínima de **3-4 años** en análisis de datos o desarrollo BI en entornos corporativos. * **Habilidades técnicas:** Dominio avanzado de Power BI, SQL, Excel y PowerPoint. (Valorables: MS Fabric, Python, MS Project). * **Idiomas:** Inglés nivel medio. * **Competencias:** Capacidad analítica, comunicación efectiva y orientación a resultados. ### **Beneficios** * **Estabilidad y carrera:** Proyectos estratégicos en empresa líder y plan de desarrollo profesional. * **Formación:** Acceso a Open University y Udemy for Business. * **Flexibilidad:** Modelo de trabajo híbrido. * **Compensación:** Beneficios exclusivos y retribución flexible. * **Entorno:** Empresa certificada como *Top Employer 2026*, con fuerte compromiso por la igualdad y diversidad.","Empresa final","**Clasificación:** Empresa final **Justificación:** La oferta es publicada directamente por ""Indra Group"", una consultora tecnológica de gran tamaño que desarrolla sus propios productos y proyectos estratégicos para sus clientes. El texto menciona explícitamente ""Únete a nuestro equipo"", ""nuestra gestión integral de RRHH"" y el compromiso con ""nuestra plantilla"", lo que confirma que la contratación es directa por parte de la empresa para trabajar en sus propios proyectos de innovación y transformación digital, y no para un servicio de intermediación de personal externo (bodyshopping)."
"https://www.linkedin.com/comm/jobs/view/4413041725/","Ingeniería de Agentes de IA en Python (She/He/They)","NTT DATA Europe & Latam","Madrid y alrededores","Madrid, Spain","64.9","53.0","True","","Híbrido","Jornada completa","Se aceptan solicitudes","6","Aquí tienes un resumen claro y conciso de la oferta: ### **Resumen de la posición: Senior Python Engineer (Agentes de IA)** NTT DATA busca un/a ingeniero/a de software senior especializado en el desarrollo y despliegue en producción de sistemas basados en IA. El enfoque no es la ingeniería de prompts, sino la construcción de **sistemas distribuidos, fiables y escalables** que integren agentes de IA en entornos corporativos. --- ### **Funciones principales** * **Diseño de arquitectura:** Crear sistemas de agentes (single y multi-agente) y flujos de ejecución. * **Desarrollo de IA:** Integrar LLMs mediante APIs, implementando *tool calling* y salidas estructuradas. * **Ingeniería de Producción:** Desarrollar sistemas robustos en Python (FastAPI, workers distribuidos) con métricas, trazabilidad (*AgentOps*) y control de fallos. * **Seguridad:** Implementar *guardrails*, validación y mecanismos de *human-in-the-loop*. ### **Requisitos imprescindibles** * **Experiencia:** +6 años en ingeniería de software con dominio de Python moderno (asincronía, tipado, testing). * **Experiencia en producción:** Trayectoria sólida en sistemas backend reales. * **Enfoque técnico:** Experiencia práctica en el desarrollo de agentes con gestión de estado y herramientas. * **Stack técnico:** Python 3.11+, FastAPI, Docker, Kubernetes, CI/CD, herramientas de observabilidad (Prometheus, Grafana, OpenTelemetry). * *Valorado:* Manejo de frameworks como LangGraph, CrewAI, LangChain o similares. ### **Beneficios principales** * **Estabilidad:** Contrato indefinido desde el primer día. * **Flexibilidad:** Modelo híbrido/teletrabajo con flexibilidad horaria y jornada intensiva los viernes y en verano. * **Desarrollo profesional:** Plan de carrera, formación continua (talleres, certificaciones) y mentoría. * **Compensación y bienestar:** Paquete de retribución flexible (ahorro fiscal), 25 días de vacaciones, ayuda para gastos de teletrabajo y acceso a eventos sociales, deportivos y de bienestar. * **Cultura:** Entorno inclusivo, diverso y enfocado en el bienestar del empleado.","Outsourcing","**Clasificación:** Outsourcing **Justificación:** La empresa se define a sí misma como una consultora tecnológica global que desarrolla su actividad en múltiples sectores (telecomunicaciones, banca, energía, administración pública, etc.) y ofrece soluciones que responden a las ""necesidades de cada cliente"". Al ser una consultora, el personal suele trabajar en proyectos para terceros bajo los estándares y necesidades de dichos clientes, que es el modelo de negocio principal de NTT DATA."
"https://www.linkedin.com/comm/jobs/view/4417887854/","Graduate data scientist","Bending Spoons","Madrid, Comunidad de Madrid, España","Madrid, Spain","64.9","53.0","True","","Híbrido","Jornada completa","Se aceptan solicitudes","N/A","Aquí tienes un resumen claro y conciso de la oferta de trabajo en **Bending Spoons**: ### **Resumen del Puesto** Bending Spoons busca profesionales para integrarse en sus equipos de ingeniería de datos. La empresa se enfoca en adquirir y optimizar productos digitales utilizando IA, operando bajo una cultura de alta exigencia, autonomía y crecimiento rápido. ### **Funciones Principales** * **Gestión de datos:** Diseñar, mejorar y asegurar la escalabilidad de pipelines y sistemas de datos. * **Desarrollo de producto:** Crear herramientas internas (motores de reporting, forecasting) para los equipos de producto. * **Análisis estratégico:** Colaborar en la toma de decisiones basada en datos y modelos analíticos. * **Integración de IA:** Utilizar inteligencia artificial para acelerar procesos y descubrir nuevas oportunidades de negocio. ### **Requisitos** * **Capacidad analítica:** Resolución de problemas complejos desde principios fundamentales y atención al detalle. * **Ambición y compromiso:** Alta iniciativa, tenacidad y responsabilidad sobre el trabajo realizado. * **Espíritu de equipo:** Disposición para colaborar, transparencia y priorización de las mejores ideas sobre las personales. * **Idiomas:** Dominio fluido del inglés (hablado y escrito). ### **Beneficios** * **Compensación competitiva:** Salarios altos según experiencia y ubicación (ej. desde 66k€ hasta +188k€ en Europa, excluyendo Londres). * **Equity:** Acceso a acciones de la empresa con descuento. * **Crecimiento:** Entorno de aprendizaje rápido y acelerado; equipos pequeños y talentosos. * **Flexibilidad y bienestar:** Horario flexible, modalidad remota (tras una estancia inicial recomendada en Milán), seguro médico premium, apoyo a la paternidad y presupuesto para formación continua. * **Beneficios extra:** Paquete de reubicación, incentivos fiscales (si aplica en Italia) y retiros anuales. ### **Proceso de Selección** * **Evaluación:** Basada en pruebas de capacidad (pueden ser desafiantes y llevar tiempo) y resultados, independientemente de la antigüedad. * **Ubicación:** Milán, Londres, Madrid, Varsovia o remoto en países seleccionados. Se recomienda pasar los primeros meses en la oficina de Milán para absorber la cultura. * **Aplicación:** Solo a través de su página de empleo oficial.","Empresa final","**Clasificación:** Empresa final **Justificación:** La empresa se describe a sí misma como una organización que ""adquiere y mejora negocios digitales, no para venderlos, sino para poseerlos y operarlos a largo plazo"". El contrato es directamente con ellos (ofrecen ""equity en la compañía""), el trabajo consiste en desarrollar productos propios (""desarrollar productos de datos internos"", ""operar productos establecidos"") y los equipos trabajan en sus propias soluciones tecnológicas. No hay mención a clientes externos ni a la prestación de servicios para terceros."
"https://www.linkedin.com/comm/jobs/view/4412645909/","Data Engineer - Pyspark","Indra Group","España","N/A","N/A","N/A","N/A","","En remoto","Jornada completa","Se aceptan solicitudes","2","Aquí tienes un resumen claro y conciso de la oferta: ### **Oferta: Desarrollador/a de Datos e IA en Indra Group** Indra busca profesionales para su equipo de Datos, Inteligencia Artificial y Robots, enfocado en proyectos tecnológicos de alto impacto y transformación digital. #### **Funciones principales:** * Desarrollo de software en **Python** siguiendo buenas prácticas y POO. * Diseño y desarrollo de procesos de tratamiento de datos con **PySpark**. * Optimización y mejora del rendimiento de procesos de datos. * Integración en entornos **CI/CD** y gestión de versiones mediante **Git**. #### **Requisitos:** * **Experiencia mínima de 2 años** trabajando con **PySpark**. * Experiencia en entornos **Cloud (AWS)**. * *Valorado:* Experiencia previa en el sector banca. #### **Beneficios destacados:** * **Estabilidad y carrera:** Proyectos a largo plazo, plan de carrera personalizado y formación continua (Open University, Udemy). * **Flexibilidad:** Autonomía en la organización del trabajo y conciliación real. * **Compensación:** Retribución competitiva, planes de compensación flexible y descuentos exclusivos para empleados. * **Entorno:** Empresa ""Top Employer 2026"" con un ambiente colaborativo, transparente y dinámico. --- **Proceso de selección:** Revisión de perfil, contacto inicial telefónico, entrevista con Talento, entrevista técnica (incluye pruebas de competencias e inglés) y oferta final.","Outsourcing","**Clasificación:** Outsourcing **Justificación:** Indra es una consultora tecnológica que presta servicios de transformación digital a terceros (como se infiere al mencionar que es ""muy valorable experiencia en sector banca"", lo que indica que el trabajador será asignado a proyectos para clientes externos). Además, la oferta menciona explícitamente trabajar en ""proyectos a largo plazo"" bajo el modelo de gran consultora con más de 50.000 profesionales, lo cual es la operativa habitual de empresas de servicios o consultoría que tercerizan talento."
"https://www.linkedin.com/comm/jobs/view/4419104381/","Junior Machine Learning Engineer","Avature","España","N/A","N/A","N/A","N/A","","En remoto","Jornada completa","Se aceptan solicitudes","N/A","Aquí tienes un resumen ejecutivo de la oferta de **Junior Machine Learning Engineer** en **Avature**: ### **Resumen del puesto** Avature, empresa líder en software SaaS para gestión de talento, busca un ingeniero junior para desarrollar e integrar modelos de Machine Learning (búsqueda semántica, matching, parsing, etc.) que impacten a millones de usuarios en un entorno colaborativo. ### **Requisitos principales** * **Formación:** Grado o Máster en Ingeniería Informática, ML o áreas afines. * **Técnicos:** Dominio de **Python** y experiencia con frameworks de ML (PyTorch o TensorFlow). Sólidos fundamentos en algoritmos, estructuras de datos y experimentación con modelos. * **Deseables:** Conocimientos en NLP, despliegue de modelos en producción y desarrollo de agentes/flujos de IA Generativa. * **Idiomas:** Nivel fluido de inglés (hablado y escrito). * **Habilidades:** Capacidad analítica, resolución de problemas y actitud colaborativa. ### **Funciones principales** * Diseñar, desarrollar y mantener módulos de software basados en ML. * Experimentar y optimizar modelos de IA bajo supervisión. * Colaborar en el ciclo de vida completo de las herramientas: desde el análisis de requerimientos y preprocesamiento de datos hasta la revisión de código y evaluación de resultados. ### **Beneficios** * **Flexibilidad:** Trabajo remoto (o híbrido) con sedes disponibles en **Madrid, Barcelona y Málaga**. Horario flexible. * **Crecimiento:** Programa de desarrollo profesional, mentoría y 4 días al año para formación/eventos. * **Compensación:** Salario competitivo con revisiones anuales, plan de retribución flexible y pago de gastos de internet. * **Bienestar:** Seguro de salud (Sanitas) y 23 días de vacaciones. * **Cultura:** Entorno dinámico, inclusivo y orientado a la innovación dentro de una compañía tecnológica global.","Empresa final","**Clasificación:** Empresa final **Justificación:** La oferta especifica claramente que Avature es un ""enterprise SaaS Solution provider"" que desarrolla su propio producto. Frases como ""We design, build, implement, and support our product ourselves"" y ""Our private cloud platform has become the product choice"" confirman que la contratación es para trabajar directamente en la plataforma propia de la empresa, no para clientes externos ni bajo una modalidad de consultoría."
